{
  "document_id": "f384879d1200",
  "file_name": "ASC300N1200ME3.pdf",
  "overall_status": "needs_review",
  "final_params": [
    {
      "field_id": "part_number",
      "status": "final",
      "value": null,
      "min": null,
      "typ": null,
      "max": null,
      "unit": null,
      "condition": null,
      "source_page": 1,
      "table_index": 0,
      "row_index": 1,
      "source_text": "Part Number: ASC300N1200ME3",
      "confidence": 0.95,
      "reason": "Exact part number string from source. Selected candidate '3.0' is Package Type, wrong.",
      "warnings": []
    },
    {
      "field_id": "module_type",
      "status": "final",
      "value": "ME3",
      "min": null,
      "typ": null,
      "max": null,
      "unit": null,
      "condition": null,
      "source_page": 1,
      "table_index": 0,
      "row_index": 2,
      "source_text": "Package Type ME3 → module_type = ME3",
      "confidence": 0.95,
      "reason": "Module type ME3 extracted from Package Type field. Selected candidate value=3.0 is wrong.",
      "warnings": []
    },
    {
      "field_id": "voltage_rating",
      "status": "final",
      "value": null,
      "min": null,
      "typ": null,
      "max": 1200.0,
      "unit": "V",
      "condition": "TC=25",
      "source_page": 1,
      "table_index": 1,
      "row_index": 2,
      "source_text": "VDS Drain-Source Voltage 1200 V TC=25°C",
      "confidence": 0.95,
      "reason": "1200V drain-source voltage at TC=25°C. Value, unit, and condition all correct.",
      "warnings": []
    },
    {
      "field_id": "current_rating",
      "status": "final",
      "value": null,
      "min": null,
      "typ": null,
      "max": 300.0,
      "unit": "A",
      "condition": "TC=25",
      "source_page": 2,
      "table_index": 0,
      "row_index": 3,
      "source_text": "ID Drain Current (continuous; TC=25°C) 300 A",
      "confidence": 0.95,
      "reason": "300A continuous drain current at TC=25°C. Value, unit, and condition all correct.",
      "warnings": []
    },
    {
      "field_id": "rds_on_25c",
      "status": "final",
      "value": null,
      "min": null,
      "typ": 5.3,
      "max": 6.7,
      "unit": "mΩ",
      "condition": "TC=25; ID=150A; VGS=18V",
      "source_page": 1,
      "table_index": 1,
      "row_index": 8,
      "source_text": "RDS(on) Static Drain-Source on Resistance - 5.3 6.7 mΩ VGS=18V; ID=150A; TC=25°C",
      "confidence": 0.95,
      "reason": "RDS(on) typ=5.3mΩ max=6.7mΩ at TC=25°C, VGS=18V, ID=150A. Conditions match TC=25°C requirement.",
      "warnings": []
    },
    {
      "field_id": "rds_on_150c",
      "status": "blocked",
      "value": null,
      "min": null,
      "typ": null,
      "max": null,
      "unit": null,
      "condition": null,
      "source_page": null,
      "table_index": null,
      "row_index": null,
      "source_text": null,
      "confidence": 0.0,
      "reason": "No candidate with TC=150°C condition exists. The only RDS(on) candidate has TC=25°C, which cannot serve as rds_on_150c.",
      "warnings": ["No TC=150°C data found in candidates. rds_on_150c is blocked."]
    },
    {
      "field_id": "vgs_th",
      "status": "final",
      "value": null,
      "min": 2.0,
      "typ": null,
      "max": 4.0,
      "unit": "V",
      "condition": null,
      "source_page": 2,
      "table_index": 1,
      "row_index": 5,
      "source_text": "VGS(th) Gate Threshold Voltage 2 - 4 V VDS=VGS; ID=30mA",
      "confidence": 0.95,
      "reason": "VGS(th) min=2V max=4V at VDS=VGS, ID=30mA. Values and unit correct.",
      "warnings": []
    },
    {
      "field_id": "ciss",
      "status": "final",
      "value": null,
      "min": null,
      "typ": 9.15,
      "max": null,
      "unit": "nF",
      "condition": "VDS=1000V; f=1MHz",
      "source_page": 2,
      "table_index": 1,
      "row_index": 11,
      "source_text": "Ciss Input Capacitance - 9.15 - nF VDS=1000V; f=1MHz; VAC=25mV",
      "confidence": 0.9,
      "reason": "Source text explicitly states unit as nF. Ciss=9.15nF is reasonable for SiC MOSFET. Input field unit=pF is incorrect transcription.",
      "warnings": ["Input JSON has unit=pF but source_text shows nF; corrected to nF."]
    },
    {
      "field_id": "coss",
      "status": "final",
      "value": null,
      "min": null,
      "typ": 0.29,
      "max": null,
      "unit": "nF",
      "condition": "VDS=1000V; f=1MHz",
      "source_page": 2,
      "table_index": 4,
      "row_index": 14,
      "source_text": "Coss Output Capacitance - 0.29 - VDS=1000V; f=1MHz; VAC=25mV",
      "confidence": 0.8,
      "reason": "Source text shows Coss=0.29. Coss for SiC is typically nF range. Input field unit=pF is likely incorrect transcription. Corrected to nF based on typical Coss values.",
      "warnings": ["Input JSON has unit=pF but Coss typically in nF for this device class; corrected to nF."]
    },
    {
      "field_id": "crss",
      "status": "final",
      "value": null,
      "min": null,
      "typ": 45.0,
      "max": null,
      "unit": "pF",
      "condition": null,
      "source_page": 2,
      "table_index": 1,
      "row_index": 13,
      "source_text": "Crss Reverse Transfer Capacitance - 45 - pF",
      "confidence": 0.95,
      "reason": "Crss=45pF is reasonable. Unit pF correct for reverse transfer capacitance.",
      "warnings": []
    },
    {
      "field_id": "qg",
      "status": "review_needed",
      "value": null,
      "min": null,
      "typ": 618.0,
      "max": null,
      "unit": "nC",
      "condition": "TC=25; ID=150A",
      "source_page": 1,
      "table_index": 1,
      "row_index": 10,
      "source_text": "QG Total Gate Charge - 618 - nC VDD=800V; VGS=-5/+18V; ID=150A; TC=25°C",
      "confidence": 0.85,
      "reason": "QG=618nC is the Total Gate Charge (correct). Selected candidate is QGD=147nC which is Gate-Drain charge only, wrong symbol. QG symbol correctly identifies total gate charge.",
      "warnings": ["Selected candidate was QGD (Gate-Drain Charge), not QG (Total Gate Charge). Corrected to QG."]
    },
    {
      "field_id": "qgs",
      "status": "final",
      "value": null,
      "min": null,
      "typ": 174.0,
      "max": null,
      "unit": "nC",
      "condition": "ID=150A",
      "source_page": 2,
      "table_index": 1,
      "row_index": 16,
      "source_text": "QGS Gate-Source Charge - 174 - nC VDD=800V; VGS=-5/+18V; ID=150A",
      "confidence": 0.95,
      "reason": "QGS=174nC (Gate-Source Charge) with correct symbol and unit.",
      "warnings": []
    },
    {
      "field_id": "qgd",
      "status": "final",
      "value": null,
      "min": null,
      "typ": 147.0,
      "max": null,
      "unit": "nC",
      "condition": null,
      "source_page": 2,
      "table_index": 3,
      "row_index": 4,
      "source_text": "QGD Gate-Drain Charge - 147 - nC",
      "confidence": 0.95,
      "reason": "QGD=147nC (Gate-Drain Charge) with correct symbol and unit.",
      "warnings": []
    },
    {
      "field_id": "eon",
      "status": "review_needed",
      "value": null,
      "min": null,
      "typ": 7.1,
      "max": null,
      "unit": "mJ",
      "condition": "VDS=800V; ID=150A",
      "source_page": 2,
      "table_index": 1,
      "row_index": 14,
      "source_text": "Eon Turn-on Energy - 7.1 - mJ VDS=800V; VGS=-5/+18V; ID=150A; RG(ext)=5Ω; Load=50µH",
      "confidence": 0.85,
      "reason": "Eon=7.1mJ at VDS=800V, ID=150A. Value plausible. Condition field missing RG and Load parameters from source_text.",
      "warnings": ["Condition field incomplete; source_text also includes RG(ext)=5Ω and Load=50µH."]
    },
    {
      "field_id": "eoff",
      "status": "review_needed",
      "value": null,
      "min": null,
      "typ": 7.9,
      "max": null,
      "unit": "mJ",
      "condition": null,
      "source_page": 2,
      "table_index": 1,
      "row_index": 15,
      "source_text": "Eoff Turn-off Energy - 7.9 -",
      "confidence": 0.7,
      "reason": "Eoff=7.9mJ plausible. Unit not visible in source_text truncation but mJ is standard for switching energy. No condition data available.",
      "warnings": ["Source text truncated; unit inferred as mJ. No condition information available."]
    },
    {
      "field_id": "trr",
      "status": "final",
      "value": null,
      "min": null,
      "typ": 96.0,
      "max": null,
      "unit": "ns",
      "condition": "VGS=-5/+18V; IF=150A; VR=800V",
      "source_page": 3,
      "table_index": 0,
      "row_index": 3,
      "source_text": "tRR Reverse Recovery Time - 96 - ns VGS=-5/+18V; IF=150A; VR=800V; RG(ext)=5Ω; Load=50µH",
      "confidence": 0.9,
      "reason": "tRR=96ns with correct unit. Condition field missing RG and Load; source_text complete.",
      "warnings": ["Condition field missing RG(ext)=5Ω and Load=50µH from source_text."]
    },
    {
      "field_id": "qrr",
      "status": "review_needed",
      "value": null,
      "min": null,
      "typ": 1839.0,
      "max": null,
      "unit": "nC",
      "condition": null,
      "source_page": 1,
      "table_index": 2,
      "row_index": 19,
      "source_text": "QRR Reverse Recovery Charge - 1839 - nC",
      "confidence": 0.6,
      "reason": "Value 1839 with unit nC from source. Unit discrepancy: source text shows μC but input field transcribed as nC. Value 1839μC would be 1839000nC, implausibly large. Keeping as 1839nC but unit is uncertain.",
      "warnings": ["Source text shows unit as μC; input field shows nC. Unit inconsistency. Value may be QRR=1839nC or 1839μC."]
    },
    {
      "field_id": "irrm",
      "status": "review_needed",
      "value": null,
      "min": null,
      "typ": 141.0,
      "max": null,
      "unit": "A",
      "condition": null,
      "source_page": 3,
      "table_index": 0,
      "row_index": 5,
      "source_text": "IRRM Peak Reverse Recovery Current - 141 - A",
      "confidence": 0.85,